{
  "job_id": "job_2026_04_05_0001",
  "job_type": "local-analysis",
  "submitted_by": "frontend-session-abc123",
  "attempt": 1,
  "state": "running",
  "submitted_at": "2026-04-05T08:00:00Z",
  "updated_at": "2026-04-05T08:03:00Z",
  "progress_percent": 45,
  "status_message": "processing source bundle",
  "error_code": null,
  "claimed_by": "local-worker-devbox-01",
  "claimed_by_auth_subject": "worker:local-worker-devbox-01",
  "lease": {
    "lease_id": "lease_job_2026_04_05_0001_attempt_1",
    "issued_at": "2026-04-05T08:00:00Z",
    "lease_expires_at": "2026-04-05T08:05:00Z",
    "lease_duration_seconds": 300,
    "renew_after_seconds": 240
  },
  "cancel_requested": false,
  "payload": {
    "input_uri": "gs://example-inputs/demo/input.json",
    "analysis_mode": "baseline"
  },
  "result_ref": null
}
